Workflow_Cluster_ID,Workflow_Name,Related_Project_ID,Task_Count,Task_IDs,Cluster_Type,Total_Estimated_Hours,Milestone_Dependencies,Execution_Phase,Department,Task_Names,Task_Names
WFC-046,Sales - Task Tasks,N/A,19,"TSK-405, TSK-413, TSK-339, TSK-278, TSK-281, TSK-307, TSK-314, TSK-315, TSK-185, TSK-050...",Parallel,40.0,N/A,Execution,Sales,Add clear next-step instructions for clients; Communicate final decision to MASEK client; Track secondary accounts (not just main emails); Set up database for accounts; Restore data processes pipelines; Hosting in Vercel (Dev account); Sign contract with Borovik for client interview; Prepare Borovik for tomorrow's client interview; Track Friday client scheduling; ...,Add clear next-step instructions for clients; Communicate final decision to MASEK client; Track secondary accounts (not just main emails); Set up database for accounts; Restore data processes pipelines; Hosting in Vercel (Dev account); Sign contract with Borovik for client interview; Prepare Borovik for tomorrow's client interview; Track Friday client scheduling; ...
WFC-047,Video - Development Tasks,N/A,5,"TSK-361, TSK-364, TSK-289, TSK-293, TSK-168",Parallel,30.0,N/A,Execution,Video,Create YouTube channels list; Build YouTube research milestone template; Create list of videos to transcribe; Create transcription execution list with IDs; Build video catalog app,Create YouTube channels list; Build YouTube research milestone template; Create list of videos to transcribe; Create transcription execution list with IDs; Build video catalog app
WFC-048,Video - Documentation Tasks,N/A,2,"TSK-174, TSK-224",Parallel,12.0,N/A,Execution,Video,Document video editor processed works; Document transcription best practices,Document video editor processed works; Document transcription best practices
WFC-049,Video - Research Tasks,N/A,3,"TSK-363, TSK-302, TSK-167",Parallel,18.0,N/A,Execution,Video,Analyze video relevancy; Research YouTube videos for transcription; Research Figma AI tutorial videos,Analyze video relevancy; Research YouTube videos for transcription; Research Figma AI tutorial videos
WFC-050,Video - Task Tasks,N/A,11,"TSK-444, TSK-445, TSK-383, TSK-290, TSK-291, TSK-306, TSK-175, TSK-DGN-2025-11-20-005, TSK-DGN-2025-11-20-006, TSK-DGN-2025-11-20-010...",Parallel,0.0,N/A,Execution,Video,Export Loom video titles; Export Loom transcriptions; Parse recent videos for LinkedIn content; Put video transcriptions into people tasks; Run prompts for video search; Task: Search for videos (template); Define Google Drive storage locations; Runway Animation Instruction Creation; Runway Animation Course Creation; ...,Export Loom video titles; Export Loom transcriptions; Parse recent videos for LinkedIn content; Put video transcriptions into people tasks; Run prompts for video search; Task: Search for videos (template); Define Google Drive storage locations; Runway Animation Instruction Creation; Runway Animation Course Creation; ...
