Role,Task_ID,Task_Title,Priority,Status,Frequency,Estimated_Hours,Objective,Key_Results,Next_Actions,Dependencies,Department_Code,Task_Category
LeadGen Department,TSK-LGN-DEPT-001,LinkedIn Prospecting - Daily Lead Search,High,Active,Daily,4.0,Identify and source new leads from LinkedIn Sales Navigator,50+ new leads sourced daily; Lead data enriched with contact info; Leads categorized by industry/role,Review and qualify sourced leads; Add to CRM system,LinkedIn Sales Navigator access,LGN,Lead Sourcing
LeadGen Department,TSK-LGN-DEPT-002,Data Scraping - Web Research,High,Active,Daily,3.0,Scrape company databases and job sites for potential leads,100+ company cards created; Contact information extracted; Data validated for accuracy,Import scraped data to CRM; Verify contact information,Data scraping tools (SalesQL, Apollo),LGN,Lead Sourcing
LeadGen Department,TSK-LGN-DEPT-003,Lead Qualification - BANT Assessment,High,Active,Daily,2.0,Qualify leads using BANT framework (Budget, Authority, Need, Timeline),20+ leads qualified daily; Lead scores assigned; MQL/SQL status updated,Hand qualified leads to sales team; Schedule discovery calls,CRM system access,LGN,Lead Qualification
LeadGen Department,TSK-LGN-DEPT-004,CRM Data Entry and Enrichment,High,Active,Daily,2.5,Maintain accurate and complete lead data in CRM system,All new leads entered into CRM; Data enrichment completed; Duplicate records removed,Update lead statuses; Segment leads by campaign,CRM system access,LGN,CRM Management
LeadGen Department,TSK-LGN-DEPT-005,Email Outreach Campaign Execution,High,Active,Daily,3.0,Execute personalized email outreach campaigns to qualified leads,50+ personalized emails sent daily; Response rate tracked; Follow-up sequences activated,Monitor email responses; Update lead engagement status,Email automation tools; Email templates,LGN,Outreach Campaigns
LeadGen Department,TSK-LGN-DEPT-006,LinkedIn Connection Requests and Messaging,Medium,Active,Daily,2.0,Build professional network and engage prospects on LinkedIn,30+ connection requests sent; Personalized messages delivered; Engagement tracked,Follow up on accepted connections; Respond to messages,LinkedIn Sales Navigator; LinkedIn account,LGN,Outreach Campaigns
LeadGen Department,TSK-LGN-DEPT-007,Follow-up Sequence Management,Medium,Active,Daily,1.5,Maintain consistent follow-up with warm leads in pipeline,Follow-up emails sent; Engagement tracked; Lead progression monitored,Update follow-up schedules; Adjust messaging based on engagement,CRM automation workflows,LGN,Lead Nurturing
LeadGen Department,TSK-LGN-DEPT-008,Industry and Competitor Research,Medium,Active,Weekly,4.0,Research target industries and competitor landscapes for better targeting,Industry reports created; Competitor analysis completed; ICP refined based on findings,Update targeting strategies; Share insights with team,Research tools (Crunchbase, BuiltWith),LGN,Market Research
LeadGen Department,TSK-LGN-DEPT-009,Daily Activity Reporting,High,Active,Daily,0.5,Document daily lead generation activities and metrics,Daily report completed; Metrics tracked; Activities logged,Submit report to team lead; Review performance metrics,Reporting template; CRM data access,LGN,Reporting
LeadGen Department,TSK-LGN-DEPT-010,Data Quality Audit and Cleanup,Low,Active,Weekly,3.0,Maintain clean and accurate lead database,Duplicate records removed; Invalid contacts cleaned; Data quality score improved,Update data quality metrics; Document cleanup process,CRM system access,LGN,Database Management
LeadGen Department,TSK-LGN-DEPT-011,Boolean Search for Prospects,High,Active,Daily,2.0,Use advanced Boolean search techniques to find targeted prospects,Targeted prospect lists created; Search queries optimized; Results documented,Refine search queries; Add results to CRM,LinkedIn; Google; Database tools,LGN,Lead Sourcing
LeadGen Department,TSK-LGN-DEPT-012,Lead Scoring and Categorization,Medium,Active,Daily,1.5,Score and categorize leads based on fit and engagement,Lead scores assigned; Leads categorized (Hot/Warm/Cold); Priority leads identified,Update lead statuses; Route high-priority leads to sales,CRM scoring system,LGN,Lead Qualification
LeadGen Department,TSK-LGN-DEPT-013,Meeting Scheduling for Sales Team,High,Active,Daily,1.0,Schedule discovery calls and meetings for qualified leads,5+ meetings scheduled weekly; Calendar invites sent; Sales team briefed,Confirm meeting details; Prepare lead context for sales,Calendar tools; CRM integration,LGN,Outreach Campaigns
LeadGen Department,TSK-LGN-DEPT-014,Lead Status Updates and Pipeline Tracking,High,Active,Daily,1.0,Update lead statuses and track progression through sales pipeline,All lead statuses current; Pipeline movements tracked; Handoff notes documented,Coordinate with sales team; Update pipeline reports,CRM system access,LGN,CRM Management
LeadGen Department,TSK-LGN-DEPT-015,Customer Profile Development,Medium,Active,Weekly,3.0,Develop and refine ideal customer profiles based on data analysis,ICP documents updated; Persona profiles created; Targeting criteria refined,Share ICP updates with team; Update prospecting strategies,Market research data; CRM analytics,LGN,Market Research
LeadGen Team Lead,TSK-LGN-TL-001,Daily Team Standup and Coordination,High,Active,Daily,0.5,Coordinate team activities and align on daily priorities,Team aligned on priorities; Blockers identified; Workload balanced,Address team blockers; Assign tasks as needed,Team communication tools (Discord),LGN,Team Management
LeadGen Team Lead,TSK-LGN-TL-002,Team Performance Review and Coaching,High,Active,Weekly,2.0,Review team performance metrics and provide coaching,Performance reviews completed; Coaching sessions conducted; Improvement plans created,Follow up on action items; Track performance improvements,Performance dashboards; CRM reports,LGN,Performance Management
LeadGen Team Lead,TSK-LGN-TL-003,Weekly Campaign Strategy Planning,High,Active,Weekly,3.0,Plan and strategize weekly outreach campaigns and initiatives,Campaign strategies defined; Target segments identified; Messaging approved,Assign campaign tasks to team; Monitor campaign execution,Market data; Historical performance data,LGN,Strategy and Planning
LeadGen Team Lead,TSK-LGN-TL-004,Lead Quality Review and Validation,High,Active,Daily,1.5,Review lead quality and ensure qualification standards are met,Lead quality validated; Qualification standards enforced; Feedback provided to team,Address quality issues; Update qualification criteria,CRM data; Quality metrics,LGN,Quality Assurance
LeadGen Team Lead,TSK-LGN-TL-005,Sales Team Handoff Coordination,High,Active,Daily,1.0,Coordinate qualified lead handoffs to sales team,Lead handoffs completed smoothly; Sales team briefed; Context provided,Follow up on handoff outcomes; Gather sales feedback,Sales team communication; CRM handoff process,LGN,Cross-Department Coordination
LeadGen Team Lead,TSK-LGN-TL-006,Weekly Department Performance Report,High,Active,Weekly,2.0,Compile and analyze weekly department performance metrics,Weekly report completed; KPIs analyzed; Insights documented,Present report to management; Identify improvement areas,CRM reports; Analytics dashboards,LGN,Reporting
LeadGen Team Lead,TSK-LGN-TL-007,Workflow Optimization and Process Review,Medium,Active,Bi-Weekly,3.0,Review and optimize lead generation workflows and processes,Process improvements identified; Workflows optimized; Efficiency gains achieved,Implement process changes; Train team on new workflows,Process documentation; Team feedback,LGN,Process Improvement
LeadGen Team Lead,TSK-LGN-TL-008,Team Training and Onboarding,Medium,Active,As Needed,4.0,Conduct training sessions for new team members and skill development,New team members onboarded; Training materials updated; Skills developed,Follow up on training progress; Assess competency,Training materials; Onboarding checklist,LGN,Training and Development
LeadGen Team Lead,TSK-LGN-TL-009,Tool and Account Management,Medium,Active,Weekly,2.0,Manage team access to tools and ensure account compliance,All team members have tool access; Accounts compliant; Usage optimized,Monitor tool usage; Renew subscriptions as needed,Tool accounts; License management,LGN,Resource Management
LeadGen Team Lead,TSK-LGN-TL-010,Monthly Strategy Review and Planning,High,Active,Monthly,4.0,Review monthly performance and plan strategic initiatives for next month,Monthly strategy reviewed; Goals set for next month; Initiatives planned,Present strategy to management; Execute strategic initiatives,Monthly reports; Market analysis,LGN,Strategy and Planning
LeadGen Team Lead,TSK-LGN-TL-011,CRM Data Quality Audit,Medium,Active,Weekly,2.5,Audit CRM data quality and ensure data integrity standards,Data quality issues identified; Cleanup tasks assigned; Standards enforced,Coordinate data cleanup; Update data standards,CRM system; Data quality tools,LGN,Quality Assurance
LeadGen Team Lead,TSK-LGN-TL-012,Marketing Collaboration and Alignment,Medium,Active,Weekly,1.5,Collaborate with marketing team on campaigns and lead sources,Campaigns aligned; Lead sources coordinated; Messaging consistent,Attend marketing meetings; Share lead insights,Marketing team communication,LGN,Cross-Department Coordination
LeadGen Team Lead,TSK-LGN-TL-013,Individual Performance Reviews,Medium,Active,Bi-Weekly,1.5,Conduct one-on-one performance reviews with team members,Performance reviews completed; Goals set; Development plans created,Follow up on action items; Track goal progress,Performance metrics; Individual reports,LGN,Performance Management
LeadGen Team Lead,TSK-LGN-TL-014,Automation and Tool Evaluation,Low,Active,Monthly,3.0,Evaluate new tools and automation opportunities for efficiency,New tools evaluated; Automation opportunities identified; ROI assessed,Implement approved tools; Train team on new tools,Tool vendors; Automation platforms,LGN,Process Improvement
LeadGen Team Lead,TSK-LGN-TL-015,Executive Dashboard Updates,High,Active,Weekly,1.0,Update executive dashboards with key department metrics,Dashboards updated; Key metrics highlighted; Trends identified,Present dashboard to executives; Address questions,Executive dashboard; CRM analytics,LGN,Reporting
