New_ID,Entity_Type,Current_ID,Name,Description,Department,Meta_Category,File_Path,Status
PRT-001,Project_Template,Project-Template-001,AI Tutorial Research to Taxonomy Integration,Complete workflow for discovering AI tutorial videos transcribing content and extracting taxonomy to enrich the library system,AID,TSM-001,ENTITIES/TASK_MANAGERS/TSM-001_Project_Templates/Project-Template-001_AI.json,Active
PRT-002,Project_Template,Project-Template-002,Complete MCP Automation Stack Setup,End-to-end MCP connector development from Claude Skills enablement through stacked automation workflows,DEV,TSM-001,ENTITIES/TASK_MANAGERS/TSM-001_Project_Templates/Project-Template-002_DEV.json,Active
PRT-003,Project_Template,Project-Template-003,Complete HR Automation Implementation,4-week implementation of HR automation including CV screening ATS and onboarding workflows,HRM,TSM-001,ENTITIES/TASK_MANAGERS/TSM-001_Project_Templates/Project-Template-003_HR.json,Active
PRT-004,Project_Template,Project-Template-004,Complete Lead Generation to Customer Conversion,Lead generation campaign from data collection through CRM integration and automation,LGN,TSM-001,ENTITIES/TASK_MANAGERS/TSM-001_Project_Templates/Project-Template-004_LG.json,Active
PRT-005,Project_Template,Project-Template-005,Enterprise Account-Based Marketing Campaign,ABM campaign for enterprise accounts with employee directory enrichment and multi-contact outreach,LGN,TSM-001,ENTITIES/TASK_MANAGERS/TSM-001_Project_Templates/Project-Template-005_LG.json,Active
PRT-006,Project_Template,Project-Template-006,Research to Taxonomy Integration Pipeline,Research discovery through taxonomy integration and reporting pipeline,AID,TSM-001,ENTITIES/TASK_MANAGERS/TSM-001_Project_Templates/Project-Template-006_RES.json,Active
PRT-007,Project_Template,Project-Template-007,System Analysis,Comprehensive system analysis project covering file distribution schema validation and documentation,AID,TSM-001,ENTITIES/TASK_MANAGERS/TSM-001_Project_Templates/Project-Template-007_System_Analysis.json,Active
PRT-008,Project_Template,Project-Template-008,VIDEO Production,Video production project from research through processing to library population,VID,TSM-001,ENTITIES/TASK_MANAGERS/TSM-001_Project_Templates/Project-Template-008_VIDEO.json,Active
